[
  {
    "name": "Edric",
    "class": "Lord",
    "baseStats": {
      "HP": 20,
      "STR": 6,
      "MAG": 2,
      "SKL": 7,
      "SPD": 8,
      "DEF": 5,
      "RES": 3,
      "LCK": 6,
      "MOV": 4
    },
    "moveType": "Infantry",
    "weapon": "Swords (P)",
    "personalSkill": "Charisma: Allies within 2 tiles +10 Hit, +5 Avoid",
    "personalGrowths": {
      "HP": 3,
      "STR": 2,
      "MAG": 2,
      "SKL": 2,
      "SPD": 2,
      "DEF": 2,
      "RES": 2,
      "LCK": 2
    },
    "promotedClass": "Great Lord",
    "promotionBonuses": {
      "HP": 3,
      "STR": 2,
      "MAG": 0,
      "SKL": 1,
      "SPD": 1,
      "DEF": 2,
      "RES": 1,
      "LCK": 0,
      "MOV": 1
    },
    "promotionWeapons": "Lances (P)",
    "personalSkillL20": {
      "skillId": "commanders_gambit",
      "level": 20
    }
  },
  {
    "name": "Kira",
    "class": "Tactician",
    "baseStats": {
      "HP": 17,
      "STR": 3,
      "MAG": 7,
      "SKL": 5,
      "SPD": 6,
      "DEF": 3,
      "RES": 5,
      "LCK": 5,
      "MOV": 4
    },
    "moveType": "Infantry",
    "weapon": "Tomes (P)",
    "personalSkill": "Foresight: +1 range on Tome attacks and counters",
    "personalGrowths": {
      "HP": 0,
      "STR": 3,
      "MAG": 3,
      "SKL": 2,
      "SPD": 2,
      "DEF": 3,
      "RES": 3,
      "LCK": 2
    },
    "promotedClass": "Grandmaster",
    "promotionBonuses": {
      "HP": 2,
      "STR": 2,
      "MAG": 3,
      "SKL": 2,
      "SPD": 1,
      "DEF": 2,
      "RES": 2,
      "LCK": 0,
      "MOV": 1
    },
    "promotionWeapons": "Swords (P)",
    "personalSkillL20": {
      "skillId": "tactical_advantage",
      "level": 20
    }
  },
  {
    "name": "Voss",
    "class": "Ranger",
    "baseStats": {
      "HP": 22,
      "STR": 8,
      "MAG": 1,
      "SKL": 6,
      "SPD": 6,
      "DEF": 7,
      "RES": 3,
      "LCK": 3,
      "MOV": 4
    },
    "moveType": "Infantry",
    "weapon": "Swords (P), Bows (P)",
    "personalSkill": "Resolve: +4 STR/DEF when below 50% HP",
    "personalGrowths": {
      "HP": 2,
      "STR": 3,
      "MAG": 0,
      "SKL": 3,
      "SPD": 3,
      "DEF": 2,
      "RES": 8,
      "LCK": 3
    },
    "promotedClass": "Vanguard",
    "promotionBonuses": {
      "HP": 4,
      "STR": 3,
      "MAG": 0,
      "SKL": 1,
      "SPD": 2,
      "DEF": 3,
      "RES": 2,
      "LCK": 0,
      "MOV": 1
    },
    "promotionWeapons": "Swords (M), Axes (P), Bows (P)",
    "personalSkillL20": {
      "skillId": "aether",
      "level": 20
    }
  },
  {
    "name": "Sera",
    "class": "Light Sage",
    "baseStats": {
      "HP": 18,
      "STR": 2,
      "MAG": 6,
      "SKL": 4,
      "SPD": 5,
      "DEF": 3,
      "RES": 7,
      "LCK": 6,
      "MOV": 4
    },
    "moveType": "Infantry",
    "weapon": "Light (P)",
    "personalSkill": "Renewal Aura: Adjacent allies heal 3 HP/turn",
    "personalGrowths": {
      "HP": 5,
      "STR": 2,
      "MAG": 3,
      "SKL": 2,
      "SPD": 2,
      "DEF": 2,
      "RES": 7,
      "LCK": 4
    },
    "promotedClass": "Light Priestess",
    "promotionBonuses": {
      "HP": 3,
      "STR": 2,
      "MAG": 2,
      "SKL": 1,
      "SPD": 1,
      "DEF": 3,
      "RES": 3,
      "LCK": 0,
      "MOV": 1
    },
    "promotionWeapons": "Staves (P)",
    "personalSkillL20": {
      "skillId": "flare",
      "level": 20
    }
  },
  {
    "name": "Rowan",
    "class": "Chevalier",
    "baseStats": {
      "HP": 21,
      "STR": 7,
      "MAG": 1,
      "SKL": 6,
      "SPD": 7,
      "DEF": 6,
      "RES": 2,
      "LCK": 3,
      "MOV": 5
    },
    "moveType": "Cavalry",
    "weapon": "Lances (P)",
    "personalSkill": "Ride Down: +3 ATK when initiating after moving 3+ cost",
    "personalGrowths": {
      "HP": 2,
      "STR": 3,
      "MAG": 2,
      "SKL": 3,
      "SPD": 3,
      "DEF": 3,
      "RES": 2,
      "LCK": 2
    },
    "promotedClass": "Holy Knight",
    "promotionBonuses": {
      "HP": 3,
      "STR": 2,
      "MAG": 5,
      "SKL": 1,
      "SPD": 1,
      "DEF": 2,
      "RES": 3,
      "LCK": 0,
      "MOV": 1
    },
    "promotionWeapons": "Staves (P)",
    "personalSkillL20": {
      "skillId": "divine_charge",
      "level": 20
    }
  },
  {
    "name": "Astrid",
    "class": "Sky Lancer",
    "baseStats": {
      "HP": 18,
      "STR": 5,
      "MAG": 3,
      "SKL": 7,
      "SPD": 8,
      "DEF": 4,
      "RES": 6,
      "LCK": 5,
      "MOV": 4
    },
    "moveType": "Flying",
    "weapon": "Lances (P)",
    "personalSkill": "Skyward: +15 Avoid when not adjacent to any ally",
    "personalGrowths": {
      "HP": 2,
      "STR": 2,
      "MAG": 2,
      "SKL": 3,
      "SPD": 3,
      "DEF": 3,
      "RES": 2,
      "LCK": 3
    },
    "promotedClass": "Seraph Knight",
    "promotionBonuses": {
      "HP": 3,
      "STR": 2,
      "MAG": 3,
      "SKL": 1,
      "SPD": 2,
      "DEF": 1,
      "RES": 2,
      "LCK": 0,
      "MOV": 1
    },
    "promotionWeapons": "Light (P)",
    "personalSkillL20": {
      "skillId": "seraph_strike",
      "level": 20
    }
  },
  {
    "name": "Cael",
    "class": "Sentinel",
    "baseStats": {
      "HP": 25,
      "STR": 9,
      "MAG": 0,
      "SKL": 5,
      "SPD": 5,
      "DEF": 9,
      "RES": 2,
      "LCK": 4,
      "MOV": 4
    },
    "moveType": "Infantry",
    "weapon": "Axes (P)",
    "personalSkill": "Intimidate: Enemies that attack Cael suffer -1 STR, -2 MAG, -1 SPD after combat",
    "personalGrowths": {
      "HP": 2,
      "STR": 2,
      "MAG": 0,
      "SKL": 2,
      "SPD": 5,
      "DEF": 2,
      "RES": 5,
      "LCK": 1
    },
    "promotedClass": "Champion",
    "promotionBonuses": {
      "HP": 4,
      "STR": 3,
      "MAG": 0,
      "SKL": 1,
      "SPD": 2,
      "DEF": 3,
      "RES": 4,
      "LCK": 0,
      "MOV": 1
    },
    "promotionWeapons": "Lances (P)",
    "personalSkillL20": {
      "skillId": "unyielding",
      "level": 20
    }
  }
]
